{
  "schemaVersion": 1,
  "entityType": "life",
  "id": "3a4e7d47-44c1-4cb0-8a14-85fc1247d78b",
  "typeTermKey": "eukaryota.animalia.chordata",
  "localizedContent": {
    "aliases": {
      "pt-BR": [],
      "pt-PT": [],
      "gn-PY": [],
      "en-US": [],
      "es-ES": [],
      "fr-FR": []
    }
  }
}
