{
  "schemaVersion": 1,
  "entityType": "life",
  "id": "c0de1f04-0c79-4216-9ec2-33325a4c4246",
  "classifications": {
    "originPlaceIds": [
      "cn"
    ],
    "bodyMetrics": {
      "size": "medium"
    }
  },
  "localizedContent": {
    "aliases": {
      "pt-BR": [],
      "pt-PT": [],
      "gn-PY": [],
      "en-US": [],
      "es-ES": [],
      "fr-FR": []
    }
  },
  "typeTermKey": "eukaryota.animalia.chordata.mammalia.carnivora.canidae.canis.canisLupusFamiliaris.chowChow"
}
