{
  "schemaVersion": 1,
  "entityType": "life",
  "id": "4b44164a-504b-4a9d-a6d0-bff6056f3b45",
  "classifications": {
    "originPlaceIds": [
      "tr"
    ],
    "bodyMetrics": {
      "size": "medium"
    }
  },
  "localizedContent": {
    "aliases": {
      "pt-BR": [],
      "pt-PT": [],
      "gn-PY": [],
      "en-US": [],
      "es-ES": [],
      "fr-FR": []
    }
  },
  "typeTermKey": "eukaryota.animalia.chordata.mammalia.carnivora.canidae.canis.canisLupusFamiliaris.zerdava"
}
