{
  "schemaVersion": 1,
  "entityType": "life",
  "id": "71dcb0d1-27b4-4022-8a3b-1e3c860ca88b",
  "classifications": {
    "originPlaceIds": [
      "ca"
    ],
    "bodyMetrics": {
      "size": "medium"
    }
  },
  "localizedContent": {
    "aliases": {
      "pt-BR": [],
      "pt-PT": [],
      "gn-PY": [],
      "en-US": [],
      "es-ES": [],
      "fr-FR": []
    }
  },
  "typeTermKey": "eukaryota.animalia.chordata.mammalia.carnivora.canidae.canis.canisLupusFamiliaris.novaScotiaDuckTollingRetriever"
}
