{
  "schemaVersion": 1,
  "entityType": "life",
  "id": "0ceb9aff-0a7d-4751-8f47-4414a9f616b7",
  "classifications": {
    "originPlaceIds": [
      "us"
    ],
    "bodyMetrics": {
      "size": "medium"
    }
  },
  "localizedContent": {
    "aliases": {
      "pt-BR": [],
      "pt-PT": [],
      "gn-PY": [],
      "en-US": [],
      "es-ES": [],
      "fr-FR": []
    }
  },
  "typeTermKey": "eukaryota.animalia.chordata.mammalia.carnivora.felidae.felis.felisCatus.laperm"
}
