{
  "schemaVersion": 1,
  "entityType": "life",
  "id": "ab810de5-0262-42d3-9471-64ab7a17fa05",
  "classifications": {
    "originPlaceIds": [
      "us"
    ],
    "bodyMetrics": {
      "size": "medium"
    }
  },
  "localizedContent": {
    "aliases": {
      "pt-BR": [],
      "pt-PT": [],
      "gn-PY": [],
      "en-US": [],
      "es-ES": [],
      "fr-FR": []
    }
  },
  "typeTermKey": "eukaryota.animalia.chordata.mammalia.carnivora.felidae.felis.felisCatus.colorpointShorthair"
}
