{
  "schemaVersion": 1,
  "entityType": "life",
  "id": "e849361a-cda7-46ff-9f7c-7c1569b0f744",
  "classifications": {
    "originPlaceIds": [
      "gr"
    ],
    "bodyMetrics": {
      "size": "medium"
    }
  },
  "localizedContent": {
    "aliases": {
      "pt-BR": [],
      "pt-PT": [],
      "gn-PY": [],
      "en-US": [],
      "es-ES": [],
      "fr-FR": []
    }
  },
  "typeTermKey": "eukaryota.animalia.chordata.mammalia.carnivora.canidae.canis.canisLupusFamiliaris.hellenicHound"
}
