{
  "schemaVersion": 1,
  "entityType": "life",
  "id": "a08d4ea0-29f7-40a2-ae4c-bff7e1388e35",
  "classifications": {
    "originPlaceIds": [
      "scotland"
    ],
    "bodyMetrics": {
      "size": "medium"
    }
  },
  "localizedContent": {
    "aliases": {
      "pt-BR": [],
      "pt-PT": [],
      "gn-PY": [],
      "en-US": [],
      "es-ES": [],
      "fr-FR": []
    }
  },
  "typeTermKey": "eukaryota.animalia.chordata.mammalia.carnivora.felidae.felis.felisCatus.scottishFold"
}
