{
  "schemaVersion": 1,
  "entityType": "life",
  "id": "e7243fcf-2c44-4acf-a80e-b57ed30fd2fe",
  "classifications": {
    "originPlaceIds": [
      "cn"
    ],
    "bodyMetrics": {
      "size": "medium"
    }
  },
  "localizedContent": {
    "aliases": {
      "pt-BR": [],
      "pt-PT": [],
      "gn-PY": [],
      "en-US": [],
      "es-ES": [],
      "fr-FR": []
    }
  },
  "typeTermKey": "eukaryota.animalia.chordata.mammalia.carnivora.canidae.canis.canisLupusFamiliaris.sharPei"
}
