{
  "schemaVersion": 1,
  "entityType": "life",
  "id": "4a86eb3c-5b42-4b02-8960-814a09fd8037",
  "classifications": {
    "originPlaceIds": [
      "ge"
    ],
    "bodyMetrics": {
      "size": "giant"
    }
  },
  "localizedContent": {
    "aliases": {
      "pt-BR": [],
      "pt-PT": [],
      "gn-PY": [],
      "en-US": [],
      "es-ES": [],
      "fr-FR": []
    }
  },
  "typeTermKey": "eukaryota.animalia.chordata.mammalia.carnivora.canidae.canis.canisLupusFamiliaris.georgianShepherd"
}
