{
  "schemaVersion": 1,
  "entityType": "life",
  "id": "6dfebe72-224f-4b09-9347-83008ce571bc",
  "classifications": {
    "originPlaceIds": [
      "am"
    ],
    "bodyMetrics": {
      "size": "giant"
    }
  },
  "localizedContent": {
    "aliases": {
      "pt-BR": [],
      "pt-PT": [],
      "gn-PY": [],
      "en-US": [],
      "es-ES": [],
      "fr-FR": []
    }
  },
  "typeTermKey": "eukaryota.animalia.chordata.mammalia.carnivora.canidae.canis.canisLupusFamiliaris.armenianGampr"
}
