{
  "schemaVersion": 1,
  "entityType": "life",
  "id": "671995d5-6ac8-4c96-96b3-f917039add4f",
  "classifications": {
    "originPlaceIds": [
      "bg"
    ],
    "bodyMetrics": {
      "size": "giant"
    }
  },
  "localizedContent": {
    "aliases": {
      "pt-BR": [],
      "pt-PT": [],
      "gn-PY": [],
      "en-US": [],
      "es-ES": [],
      "fr-FR": []
    }
  },
  "typeTermKey": "eukaryota.animalia.chordata.mammalia.carnivora.canidae.canis.canisLupusFamiliaris.karakachan"
}
