{
  "schemaVersion": 1,
  "entityType": "life",
  "id": "1629f053-1f98-4802-a151-41d110355af0",
  "classifications": {
    "originPlaceIds": [
      "us"
    ],
    "bodyMetrics": {
      "size": "large"
    }
  },
  "localizedContent": {
    "aliases": {
      "pt-BR": [],
      "pt-PT": [],
      "gn-PY": [],
      "en-US": [],
      "es-ES": [],
      "fr-FR": []
    }
  },
  "typeTermKey": "eukaryota.animalia.chordata.mammalia.carnivora.canidae.canis.canisLupusFamiliaris.americanBully"
}
