{
  "schemaVersion": 1,
  "entityType": "life",
  "id": "9f5efc44-f066-4f00-90e9-2b954aa095ba",
  "classifications": {
    "originPlaceIds": [
      "de"
    ],
    "bodyMetrics": {
      "size": "small"
    }
  },
  "localizedContent": {
    "aliases": {
      "pt-BR": [],
      "pt-PT": [],
      "gn-PY": [],
      "en-US": [],
      "es-ES": [],
      "fr-FR": []
    }
  },
  "typeTermKey": "eukaryota.animalia.chordata.mammalia.carnivora.canidae.canis.canisLupusFamiliaris.miniatureSchnauzer"
}
