{
  "schemaVersion": 1,
  "entityType": "life",
  "id": "e3cec626-e7b1-4fd2-98be-ee5e29fc42fc",
  "classifications": {
    "originPlaceIds": [
      "england"
    ],
    "bodyMetrics": {
      "size": "small"
    }
  },
  "localizedContent": {
    "aliases": {
      "pt-BR": [],
      "pt-PT": [],
      "gn-PY": [],
      "en-US": [],
      "es-ES": [],
      "fr-FR": []
    }
  },
  "typeTermKey": "eukaryota.animalia.chordata.mammalia.carnivora.canidae.canis.canisLupusFamiliaris.yorkshireTerrier"
}
