{
  "schemaVersion": 1,
  "entityType": "life",
  "id": "e7beac51-c7c5-431b-9e66-75660a473dfe",
  "classifications": {
    "originPlaceIds": [
      "fixture-place"
    ],
    "bodyMetrics": {
      "size": "default",
      "stageMetrics": {
        "periodUnit": "months",
        "male": {
          "newborn": {
            "period": [
              null,
              1
            ],
            "weight": {
              "live": [
                0.5,
                2
              ]
            },
            "measure": {
              "height": [
                8,
                18
              ],
              "length": [
                12,
                28
              ]
            }
          },
          "young": {
            "period": [
              1,
              12
            ],
            "weight": {
              "live": [
                1.5,
                3.5
              ]
            },
            "measure": {
              "height": [
                16,
                26
              ],
              "length": [
                24,
                38
              ]
            }
          },
          "adult": {
            "period": [
              12,
              null
            ],
            "weight": {
              "live": [
                3,
                4
              ]
            },
            "measure": {
              "height": [
                24,
                28
              ],
              "length": [
                35,
                40
              ]
            }
          }
        },
        "female": {
          "newborn": {
            "period": [
              null,
              2
            ],
            "weight": {
              "live": [
                0.4,
                1.8
              ]
            },
            "measure": {
              "height": [
                7,
                17
              ],
              "length": [
                11,
                27
              ]
            }
          },
          "young": {
            "period": [
              2,
              11
            ],
            "weight": {
              "live": [
                1.4,
                3.3
              ]
            },
            "measure": {
              "height": [
                15,
                25
              ],
              "length": [
                23,
                37
              ]
            }
          },
          "adult": {
            "period": [
              11,
              null
            ],
            "weight": {
              "live": [
                2.8,
                3.8
              ]
            },
            "measure": {
              "height": [
                23,
                27
              ],
              "length": [
                34,
                39
              ]
            }
          }
        }
      }
    }
  },
  "localizedContent": {
    "aliases": {
      "pt-BR": [],
      "pt-PT": [],
      "gn-PY": [],
      "en-US": [
        "Toy Poodle"
      ],
      "es-ES": [],
      "fr-FR": []
    }
  },
  "typeTermKey": "eukaryota.animalia.chordata.mammalia.carnivora.canidae.canis.canisLupusFamiliaris.poodle.poodleToy"
}
