{
  "schemaVersion": 1,
  "entityType": "life",
  "id": "29466448-fd26-4a0f-bb69-345407feeb0c",
  "classifications": {
    "originPlaceIds": [
      "england"
    ],
    "bodyMetrics": {
      "size": "large"
    }
  },
  "localizedContent": {
    "aliases": {
      "pt-BR": [],
      "pt-PT": [],
      "gn-PY": [],
      "en-US": [],
      "es-ES": [],
      "fr-FR": []
    }
  },
  "typeTermKey": "eukaryota.animalia.chordata.mammalia.carnivora.felidae.felis.felisCatus.britishShorthair"
}
