{
  "schemaVersion": 1,
  "entityType": "life",
  "id": "f41ad814-a0ea-48d4-9eb5-aba08d314b01",
  "classifications": {
    "originPlaceIds": [
      "ie"
    ],
    "bodyMetrics": {
      "size": "giant"
    }
  },
  "localizedContent": {
    "aliases": {
      "pt-BR": [],
      "pt-PT": [],
      "gn-PY": [],
      "en-US": [],
      "es-ES": [],
      "fr-FR": []
    }
  },
  "typeTermKey": "eukaryota.animalia.chordata.mammalia.carnivora.canidae.canis.canisLupusFamiliaris.irishWolfhound"
}
