{
  "schemaVersion": 1,
  "entityType": "life",
  "id": "c47ca302-0e20-48fd-8c34-f744bb5f4d16",
  "classifications": {
    "originPlaceIds": [
      "hu"
    ],
    "bodyMetrics": {
      "size": "giant"
    }
  },
  "localizedContent": {
    "aliases": {
      "pt-BR": [],
      "pt-PT": [],
      "gn-PY": [],
      "en-US": [],
      "es-ES": [],
      "fr-FR": []
    }
  },
  "typeTermKey": "eukaryota.animalia.chordata.mammalia.carnivora.canidae.canis.canisLupusFamiliaris.komondor"
}
