{
  "schemaVersion": 1,
  "entityType": "life",
  "id": "26455a3d-2308-4447-bf48-7ac8a81464d0",
  "classifications": {
    "originPlaceIds": [
      "co"
    ],
    "bodyMetrics": {
      "size": "medium"
    }
  },
  "localizedContent": {
    "aliases": {
      "pt-BR": [],
      "pt-PT": [],
      "gn-PY": [],
      "en-US": [],
      "es-ES": [],
      "fr-FR": []
    }
  },
  "typeTermKey": "eukaryota.animalia.chordata.mammalia.carnivora.canidae.canis.canisLupusFamiliaris.colombianFinoHound"
}
