{
  "schemaVersion": 1,
  "entityType": "life",
  "id": "596392dd-fa10-42fe-ba8a-ab5e2c49bf56",
  "classifications": {
    "originPlaceIds": [
      "ru"
    ],
    "bodyMetrics": {
      "size": "large"
    }
  },
  "localizedContent": {
    "aliases": {
      "pt-BR": [],
      "pt-PT": [],
      "gn-PY": [],
      "en-US": [],
      "es-ES": [],
      "fr-FR": []
    }
  },
  "typeTermKey": "eukaryota.animalia.chordata.mammalia.carnivora.felidae.felis.felisCatus.kurilianBobtail"
}
