{
  "schemaVersion": 1,
  "entityType": "life",
  "id": "abd1470f-3fc8-41cf-a39b-21e8ca8d224c",
  "classifications": {
    "originPlaceIds": [
      "mx"
    ],
    "bodyMetrics": {
      "size": "small"
    }
  },
  "localizedContent": {
    "aliases": {
      "pt-BR": [],
      "pt-PT": [],
      "gn-PY": [],
      "en-US": [],
      "es-ES": [],
      "fr-FR": []
    }
  },
  "typeTermKey": "eukaryota.animalia.chordata.mammalia.carnivora.canidae.canis.canisLupusFamiliaris.chihuahua"
}
