{
  "schemaVersion": 1,
  "entityType": "life",
  "id": "132ba143-aee0-435f-9ca4-a87d63eb1645",
  "classifications": {
    "originPlaceIds": [
      "in"
    ],
    "bodyMetrics": {
      "size": "large"
    }
  },
  "localizedContent": {
    "aliases": {
      "pt-BR": [],
      "pt-PT": [],
      "gn-PY": [],
      "en-US": [],
      "es-ES": [],
      "fr-FR": []
    }
  },
  "typeTermKey": "eukaryota.animalia.chordata.mammalia.carnivora.canidae.canis.canisLupusFamiliaris.chippiparai"
}
