{
  "schemaVersion": 1,
  "entityType": "life",
  "id": "ad0a7d4e-2381-40d8-bfcd-3975fb342e74",
  "classifications": {
    "originPlaceIds": [
      "us"
    ],
    "bodyMetrics": {
      "size": "medium"
    }
  },
  "localizedContent": {
    "aliases": {
      "pt-BR": [],
      "pt-PT": [],
      "gn-PY": [],
      "en-US": [],
      "es-ES": [],
      "fr-FR": []
    }
  },
  "typeTermKey": "eukaryota.animalia.chordata.mammalia.carnivora.felidae.felis.felisCatus.americanCurl"
}
